{
  "record_id": "fbc-jessica-reveal-archery-lesson",
  "collection": "Fireside BMX Chat",
  "subseries": null,
  "episode_number": null,
  "dossier_type": "Interview Dossier",
  "recording_type": [
    "experiential interview",
    "oral history",
    "instructional recording",
    "archery lesson"
  ],
  "title": "Fireside BMX Chat and Archery Lesson with Jessica Reveal",
  "published_title": "Fireside BMX Chat & Archery Lesson w/ Harry Leary's Niece - Jessica Reveal - Learn to shoot & more..",
  "source_url": "https://www.youtube.com/watch?v=Gyuvtnze9N8",
  "host": "Kyle A. Huffman",
  "guests": [
    "Jessica Reveal"
  ],
  "participants": [
    "Kyle A. Huffman",
    "Jessica Reveal",
    "Anne-Marie Huffman"
  ],
  "duration": "55:16",
  "recording_date": null,
  "publication_date": null,
  "location": "Archery range; exact facility not supplied in the submitted materials",
  "language": "en",
  "summary": "Jessica Reveal teaches Kyle archery safety, equipment, and shooting fundamentals while sharing memories of her uncle Harry Leary. The discussion moves through family humor, motorcycles and dirt-bike riding, Harry’s encouragement of Jessica’s archery and hunting ambitions, failure, stubbornness, anger, legacy, and family bonds.",
  "historical_significance": "The recording preserves Harry Leary’s influence as an uncle and mentor through the act of Jessica teaching another person. Skill transfer, family testimony, and reflection on failure operate together rather than as separate subjects.",
  "subjects": [
    "Jessica Reveal",
    "Harry Leary",
    "archery",
    "range safety",
    "compound bows",
    "arrows",
    "mentorship",
    "hunting",
    "family",
    "line dancing",
    "pranks",
    "dirt bikes",
    "desert tortoise",
    "stubbornness",
    "failure leads to success",
    "anger",
    "legacy"
  ],
  "transcript_status": "raw machine transcript captured; timestamp-normalized working transcript created; speaker and fidelity verification pending",
  "preservation_status": [
    "source-captured",
    "dossier-compiled",
    "transcript-verification-pending"
  ],
  "rights": "All rights reserved unless separately documented.",
  "compiled_date": "2026-07-20",
  "notes": [
    "The public description lists the elbow incident among discussed topics. An exact “elbow” phrase was not located in the supplied machine transcript; this topic should be checked directly against the recording before being indexed as confirmed dialogue.",
    "The original clip-notes PDF contains an unrelated personal review on its final page. The public repository includes a cleaned eight-page copy with that page removed; the unaltered original remains in the private supplement.",
    "The clip-notes document includes numbering irregularities and internal reminders. These are preserved as production history, not silently polished.",
    "Archery safety statements are preserved as interview content and are not presented by this repository as a substitute for qualified in-person instruction."
  ]
}
