{
  "record_id": "fbc-linda-leary-taylor-walk-talk",
  "collection": "Fireside BMX Chat",
  "subseries": null,
  "episode_number": null,
  "dossier_type": "Interview Dossier",
  "recording_type": [
    "on-location interview",
    "family oral history",
    "memorial walk",
    "place-based remembrance"
  ],
  "title": "A Walk & Talk with Linda Leary Taylor",
  "published_title": "Fireside BMX Chat: Walk w/ Linda -Sister- to Harry Leary's \"Havasu Memorial Walkway\" Paver - Audio",
  "source_url": "https://www.youtube.com/watch?v=2EWCctB6bss",
  "host": "Kyle A. Huffman",
  "guests": [
    "Linda Leary Taylor"
  ],
  "participants": [
    "Kyle A. Huffman",
    "Linda Leary Taylor",
    "Anne-Marie Huffman"
  ],
  "duration": "1:13:28",
  "recording_date": "One-year anniversary of Harry Leary’s passing; exact calendar date not supplied in the submitted materials",
  "publication_date": null,
  "location": "London Bridge and Memorial Walkway, Lake Havasu City, Arizona",
  "language": "en",
  "summary": "Kyle, Anne-Marie, and Linda Leary Taylor walk across the London Bridge toward Harry Leary’s memorial paver. Linda shares childhood memories, family relationships, Harry’s early riding, his professional life, personal relationships, family concerns, his death, and her evolving understanding of his legacy.",
  "historical_significance": "The physical route gives the interview a memorial structure: the conversation begins at the bridge, unfolds while walking, and concludes at Harry’s paver. Linda’s first-person family testimony preserves aspects of Harry’s life that are absent from race records and magazine coverage.",
  "subjects": [
    "Linda Leary Taylor",
    "Harry Leary",
    "London Bridge",
    "Lake Havasu City",
    "memorial paver",
    "childhood",
    "family history",
    "early bicycle jumping",
    "JMC",
    "Diamondback",
    "Shelly",
    "CTE advocacy",
    "death and grief",
    "signed number plate",
    "healing"
  ],
  "transcript_status": "raw machine transcript captured; timestamp-normalized working transcript created; speaker and fidelity verification pending",
  "preservation_status": [
    "source-captured",
    "dossier-compiled",
    "transcript-verification-pending"
  ],
  "rights": "All rights reserved unless separately documented.",
  "compiled_date": "2026-07-20",
  "notes": [
    "The press release and public description identify the recording as occurring on the one-year anniversary of Harry Leary’s passing; the exact date is not supplied and is therefore not inferred.",
    "A pre-production outline describes Anne-Marie as 22 months old, but this has not been normalized into metadata without a verified recording date.",
    "Statements about family relationships, CTE, death, and personal behavior are preserved as Linda Leary Taylor’s testimony.",
    "The machine transcript contains many spelling and name errors and requires full speaker-level verification."
  ]
}
